{
  "schema": 1,
  "id": "0001-initial",
  "title": "Initial app",
  "route": "initial",
  "step": "discovery",
  "status": "open",
  "createdAt": "2026-10-07",
  "cursor": {
    "pending": []
  },
  "approvals": {},
  "lockedTests": {
    "apps/web/e2e/list.spec.ts": {
      "sha": "684669a2169d",
      "at": "2026-10-07T00:00:00.000Z",
      "evidence": "existing",
      "slice": "S1"
    }
  }
}
